{"allowlist_sha256":"efa78293fd8ee4eb354aa61a7e67aa590f7db81f8374808aeeb556fb29fbbf5d","artifacts":[{"logical_id":"import-review","media_type":"application/json","path":"objects/84d075f10e259aa28e07e52fb901d1cb84003eea88d98a6584fcc39c57439035.json","sha256":"84d075f10e259aa28e07e52fb901d1cb84003eea88d98a6584fcc39c57439035"},{"logical_id":"bill-replay","media_type":"application/json","path":"objects/d0acad97bcf052da7fa8c1801bc9800ccb69d3771bd5899490cd463430113a5f.json","sha256":"d0acad97bcf052da7fa8c1801bc9800ccb69d3771bd5899490cd463430113a5f"},{"logical_id":"tariff-comparison","media_type":"application/json","path":"objects/ce1f3e6ae3a48a99be4205f126bdefb506a2f25d74ab80fd9b71041c0f7cdf97.json","sha256":"ce1f3e6ae3a48a99be4205f126bdefb506a2f25d74ab80fd9b71041c0f7cdf97"},{"logical_id":"scenario-inputs","media_type":"application/json","path":"objects/91d3b6745f757c6fd5275cd872cc3056997ea15c8537a355437ae81fffe2c327.json","sha256":"91d3b6745f757c6fd5275cd872cc3056997ea15c8537a355437ae81fffe2c327"},{"logical_id":"reference-result","media_type":"application/json","path":"objects/b3354ba5cd30769d5340c801498c82a84c70cf92f61aa900912099a9698cb9e2.json","sha256":"b3354ba5cd30769d5340c801498c82a84c70cf92f61aa900912099a9698cb9e2"},{"logical_id":"heuristic-result","media_type":"application/json","path":"objects/c4995490569939d9c105f08f6670f5701cab62438703ff73429900159dbd539e.json","sha256":"c4995490569939d9c105f08f6670f5701cab62438703ff73429900159dbd539e"},{"logical_id":"solver-result","media_type":"application/json","path":"objects/0f389a8376b80bbcdc2a5403f66093ea6658c825f47fea16af16cccce32f0c2e.json","sha256":"0f389a8376b80bbcdc2a5403f66093ea6658c825f47fea16af16cccce32f0c2e"},{"logical_id":"verification-record","media_type":"application/json","path":"objects/d6dd8fa084f1c0e0bcc19e5a67f40d01100e407f0fd41774a6dc2514cd0fd535.json","sha256":"d6dd8fa084f1c0e0bcc19e5a67f40d01100e407f0fd41774a6dc2514cd0fd535"},{"logical_id":"redacted-report","media_type":"application/json","path":"objects/ccb208c3415b27c079082821da37cc79768a137d43ec7e7a89a0133bcb963822.json","sha256":"ccb208c3415b27c079082821da37cc79768a137d43ec7e7a89a0133bcb963822"}],"calculation_manifest_sha256":"cd276249a674617a2fee401154bf265292d65d5d6681d7f306f52dde533e6492","generation_command":"make demo-artifacts","manifest_version":"public-demo-manifest-v1","simulated_only":true}
